Banking Name,Account,Account Name,Inicial,Bank Name,BSB Number,Account Number,Swift Code,Bank Address,Notes,Status,Attachments,Credit,Debit,Transaction,Credit copy,Banking copy
TS-Anz Bank_Trust,Time Study,,TS,Anz Bank_Trust,,,,,,,,CREDIT-2025/06/16_recVI7D8dYp6M9VX2,"DEBIT-2025/06/18_recsqW5Oz3gEEejYF, DEBIT-2025/06/18_recVtYvGYi9wQx6X7",,"TS-Anz Bank_Trust Min Su KANG_Credit AUD $ 8300,TS-Anz Bank_Trust Hyekyung BAEK_Credit AUD $ 8300,TS-Anz Bank_Trust Heena YANG_Credit AUD $ 12400,TS-Anz Bank_Trust Yesel KIM_Credit AUD $ 8580,TS-Anz Bank_Trust Euisun AHN_Credit AUD $ 13200,TS-Anz Bank_Trust Wheesung ROH_Credit AUD $ 10700,TS-Anz Bank_Trust Hayoung JUNG_Credit AUD $ 8300,TS-Anz Bank_Trust Jisoo RYU_Credit AUD $ 7992,TS-Anz Bank_Trust DET (Department of Education and Training Victoria)_Debit AUD $ 1018.68,TS-Anz Bank_Trust DET (Department of Education and Training Victoria)_Debit AUD $ 1018.68,TS-Anz Bank_Trust DET (Department of Education and Training Victoria)_Debit AUD $ 1018.68,TS-Anz Bank_Trust Jiyeon LEE_Credit AUD $ 8800,TS-Anz Bank_Trust Bongmin CHOI_Credit AUD $ 12400,TS-Anz Bank_Trust Youjin AHN_Credit AUD $ 13198,TS-Anz Bank_Trust Sohyun JEONG_Credit AUD $ 9098,TS-Anz Bank_Trust Minju OH_Credit AUD $ 9598,TS-Anz Bank_Trust DET (Department of Education and Training Victoria)_Debit AUD $ 1018.68,TS-Anz Bank_Trust DET (Department of Education and Training Victoria)_Debit AUD $ 1352.78,TS-Anz Bank_Trust DET (Department of Education and Training Victoria)_Debit AUD $ 1018.68,TS-Anz Bank_Trust DET (Department of Education and Training Victoria)_Debit AUD $ 1018.68,TS-Anz Bank_Trust Brady Hotel Hardware_Debit AUD $ 5040,TS-Anz Bank_Trust Brady Hotel Hardware_Debit AUD $ 3045,TS-Anz Bank_Trust Brady Hotel Hardware_Debit AUD $ 3045,TS-Anz Bank_Trust Brady Hotel Hardware_Debit AUD $ 3045,TS-Anz Bank_Trust Brady Hotel Hardware_Debit AUD $ 3045,TS-Anz Bank_Trust Brady Hotel Hardware_Debit AUD $ 3045,TS-Anz Bank_Trust Brady Hotel Hardware_Debit AUD $ 3045,TS-Anz Bank_Trust Brady Hotel Hardware_Debit AUD $ 3045,TS-Anz Bank_Trust Brady Hotel Hardware_Debit AUD $ 5040,TS-Anz Bank_Trust Brady Hotel Hardware_Debit AUD $ 3045,TS-Anz Bank_Trust Brady Hotel Hardware_Debit AUD $ 5040,TS-Anz Bank_Trust Sung Bae LEE_Credit AUD $ 12120,TS-Anz Bank_Trust DET (Department of Education and Training Victoria)_Debit AUD $ 1018.68,TS-Anz Bank_Trust Brady Hotel Hardware_Debit AUD $ 6160,TS-Anz Bank_Trust DET (Department of Education and Training Victoria)_Debit AUD $ 1018.68,TS-Anz Bank_Trust DET (Department of Education and Training Victoria)_Debit AUD $ 1018.68,TS-Anz Bank_Trust Jiyoung CHOI_Credit AUD $ 13398,TS-Anz Bank_Trust DET (Department of Education and Training Victoria)_Debit AUD $ 1352.78,TS-Anz Bank_Trust Brady Hotel Hardware_Debit AUD $ 5040,TS-Anz Bank_Trust DET (Department of Education and Training Victoria)_Debit AUD $ 1018.68,TS-Anz Bank_Trust DET (Department of Education and Training Victoria)_Debit AUD $ 1018.68,TS-Anz Bank_Trust DET (Department of Education and Training Victoria)_Debit AUD $ 1352.78,TS-Anz Bank_Trust DET (Department of Education and Training Victoria)_Debit AUD $ 1018.68,TS-Anz Bank_Trust DET (Department of Education and Training Victoria)_Debit AUD $ 1352.78,TS-Anz Bank_Trust DET (Department of Education and Training Victoria)_Debit AUD $ 1018.68,TS-Anz Bank_Trust DET (Department of Education and Training Victoria)_Debit AUD $ 1018.68,TS-Anz Bank_Trust DET (Department of Education and Training Victoria)_Debit AUD $ 1018.68,TS-Anz Bank_Trust DET (Department of Education and Training Victoria)_Debit AUD $ 1018.68,TS-Anz Bank_Trust Hyojin HEO_Credit AUD $ 8000,TS-Anz Bank_Trust RED Uhak_Debit AUD $ 1300,TS-Anz Bank_Trust RED Uhak_Debit AUD $ 1400,TS-Anz Bank_Trust RED Uhak_Debit AUD $ 1400,TS-Anz Bank_Trust RED Uhak_Debit AUD $ 1300,TS-Anz Bank_Trust RED Uhak_Debit AUD $ 1400,TS-Anz Bank_Trust Jacana Apartments _Debit AUD $ 3591,TS-Anz Bank_Trust Jacana Apartments _Debit AUD $ 4536,TS-Anz Bank_Trust Lime Education_Credit AUD $ 15800,TS-Anz Bank_Trust Lime Education_Debit AUD $ 1500,TS-Anz Bank_Trust RED Uhak_Credit AUD $ 9900,TS-Anz Bank_Trust RED Uhak_Debit AUD $ 1400,TS-Anz Bank_Trust Punthill Oakleigh_Debit AUD $ 2625,TS-Anz Bank_Trust RED Uhak_Credit AUD $ 9750,TS-Anz Bank_Trust RED Uhak_Debit AUD $ 1325,TS-Anz Bank_Trust Punthill Oakleigh_Debit AUD $ 2625,TS-Anz Bank_Trust Punthill Oakleigh_Debit AUD $ 2875,TS-Anz Bank_Trust RED Uhak_Credit AUD $ 9900,TS-Anz Bank_Trust RED Uhak_Debit AUD $ 1400,TS-Anz Bank_Trust Punthill Oakleigh_Debit AUD $ 2625,TS-Anz Bank_Trust RED Uhak_Credit AUD $ 9750,TS-Anz Bank_Trust RED Uhak_Debit AUD $ 1325,TS-Anz Bank_Trust Punthill Oakleigh_Debit AUD $ 2625,TS-Anz Bank_Trust Sooa KIM_Credit AUD $ 13940,TS-Anz Bank_Trust Punthill Oakleigh_Debit AUD $ 4760,TS-Anz Bank_Trust RED Uhak_Credit AUD $ 9900,TS-Anz Bank_Trust RED Uhak_Debit AUD $ 1400,TS-Anz Bank_Trust Punthill Oakleigh_Debit AUD $ 2625,TS-Anz Bank_Trust Hyojin HEO_Credit AUD $ 8000,TS-Anz Bank_Trust Eunjung HONG_Credit AUD $ 8300,TS-Anz Bank_Trust Oakleigh Grammar_Debit AUD $ 2100,TS-Anz Bank_Trust Brady Hotel Hardware_Debit AUD $ 640,TS-Anz Bank_Trust Brady Hotel Hardware_Debit AUD $ 3045,TS-Anz Bank_Trust Brady Hotel Hardware_Debit AUD $ 3045,TS-Anz Bank_Trust Jiyoung KIM_Credit AUD $ 8800,TS-Anz Bank_Trust Oakleigh Grammar_Debit AUD $ 2625,TS-Anz Bank_Trust Oakleigh Grammar_Debit AUD $ 2625,TS-Anz Bank_Trust Oakleigh Grammar_Debit AUD $ 2625,TS-Anz Bank_Trust Oakleigh Grammar_Debit AUD $ 2625,TS-Anz Bank_Trust Oakleigh Grammar_Debit AUD $ 2100,TS-Anz Bank_Trust Oakleigh Grammar_Debit AUD $ 2100,TS-Anz Bank_Trust Oakleigh Grammar_Debit AUD $ 2100,TS-Anz Bank_Trust Oakleigh Grammar_Debit AUD $ 2625,TS-Anz Bank_Trust Oakleigh Grammar_Debit AUD $ 2625,TS-Anz Bank_Trust Oakleigh Grammar_Debit AUD $ 2625,TS-Anz Bank_Trust Oakleigh Grammar_Debit AUD $ 2625,TS-Anz Bank_Trust Oakleigh Grammar_Debit AUD $ 2625,TS-Anz Bank_Trust Punthill Oakleigh_Debit AUD $ 4490,TS-Anz Bank_Trust Punthill Oakleigh_Debit AUD $ 3400,TS-Anz Bank_Trust Punthill Oakleigh_Debit AUD $ 6634,TS-Anz Bank_Trust Punthill Oakleigh_Debit AUD $ 2625,TS-Anz Bank_Trust Punthill Oakleigh_Debit AUD $ 2875,TS-Anz Bank_Trust Acknowledge Education_Debit AUD $ 1855,TS-Anz Bank_Trust Acknowledge Education_Debit AUD $ 2080,TS-Anz Bank_Trust Acknowledge Education_Debit AUD $ 2080,TS-Anz Bank_Trust Acknowledge Education_Debit AUD $ 2080,TS-Anz Bank_Trust Acknowledge Education_Debit AUD $ 2080,TS-Anz Bank_Trust Acknowledge Education_Debit AUD $ 2080,TS-Anz Bank_Trust Acknowledge Education_Debit AUD $ 2080,TS-Anz Bank_Trust Brady Hotel Flinders_Debit AUD $ 3565,TS-Anz Bank_Trust Brady Hotel Flinders_Debit AUD $ 3675,TS-Anz Bank_Trust Brady Hotel Flinders_Debit AUD $ 4885,TS-Anz Bank_Trust Brady Hotel Flinders_Debit AUD $ 4655,TS-Anz Bank_Trust Punthill Oakleigh_Debit AUD $ 2625,TS-Anz Bank_Trust Punthill Oakleigh_Debit AUD $ 2625,TS-Anz Bank_Trust Ayeong CHOI_Credit AUD $ 9800,TS-Anz Bank_Trust Sehee KIM_Credit AUD $ 9400,TS-Anz Bank_Trust Hajung LEE_Credit AUD $ 9900,TS-Anz Bank_Trust Soyoun PARK_Credit AUD $ 9800,TS-Anz Bank_Trust Hyoju LIM_Credit AUD $ 9245,TS-Anz Bank_Trust Nahyun KANG_Credit AUD $ 9600,TS-Anz Bank_Trust Eunyeong CHAE_Credit AUD $ 9400,TS-Anz Bank_Trust Punthill Oakleigh_Debit AUD $ 2625,TS-Anz Bank_Trust Minyoung RYU_Credit AUD $ 10400,TS-Anz Bank_Trust Youngjin LEE_Credit AUD $ 9800,TS-Anz Bank_Trust Yoonsu SHIN_Credit AUD $ 9600,TS-Anz Bank_Trust Aekyung PAK_Credit AUD $ 9400,TS-Anz Bank_Trust Hyemi CHOI_Credit AUD $ 9400,TS-Anz Bank_Trust Brady Hotel Flinders_Debit AUD $ 3510,TS-Anz Bank_Trust Brady Hotel Flinders_Debit AUD $ 3255,TS-Anz Bank_Trust Brady Hotel Flinders_Debit AUD $ 3255,TS-Anz Bank_Trust Brady Hotel Flinders_Debit AUD $ 3355,TS-Anz Bank_Trust Brady Hotel Flinders_Debit AUD $ 3755,TS-Anz Bank_Trust Brady Hotel Flinders_Debit AUD $ 3855,TS-Anz Bank_Trust Brady Hotel Flinders_Debit AUD $ 3410,TS-Anz Bank_Trust Brady Hotel Flinders_Debit AUD $ 5305,TS-Anz Bank_Trust Brady Hotel Flinders_Debit AUD $ 4255,TS-Anz Bank_Trust Brady Hotel Flinders_Debit AUD $ 4840,TS-Anz Bank_Trust Brady Hotel Flinders_Debit AUD $ 4385,TS-Anz Bank_Trust Brady Hotel Flinders_Debit AUD $ 4570,TS-Anz Bank_Trust Brady Hotel Flinders_Debit AUD $ 3885,TS-Anz Bank_Trust Acknowledge Education_Debit AUD $ 1855,TS-Anz Bank_Trust Acknowledge Education_Debit AUD $ 2080,TS-Anz Bank_Trust Acknowledge Education_Debit AUD $ 2080,TS-Anz Bank_Trust Acknowledge Education_Debit AUD $ 2080,TS-Anz Bank_Trust Acknowledge Education_Debit AUD $ 2080,TS-Anz Bank_Trust Acknowledge Education_Debit AUD $ 2080,TS-Anz Bank_Trust Acknowledge Education_Debit AUD $ 2580,TS-Anz Bank_Trust Acknowledge Education_Debit AUD $ 2080,TS-Anz Bank_Trust Acknowledge Education_Debit AUD $ 2080,TS-Anz Bank_Trust Acknowledge Education_Debit AUD $ 2080,TS-Anz Bank_Trust Acknowledge Education_Debit AUD $ 2280,TS-Anz Bank_Trust Acknowledge Education_Debit AUD $ 2280,TS-Anz Bank_Trust Acknowledge Education_Debit AUD $ 1855,TS-Anz Bank_Trust Acknowledge Education_Debit AUD $ 1855,TS-Anz Bank_Trust Punthill Oakleigh_Debit AUD $ 3570,TS-Anz Bank_Trust Acknowledge Education_Debit AUD $ 2080,TS-Anz Bank_Trust Acknowledge Education_Debit AUD $ 2080,TS-Anz Bank_Trust Acknowledge Education_Debit AUD $ 2080,TS-Anz Bank_Trust Acknowledge Education_Debit AUD $ 1855,TS-Anz Bank_Trust Acknowledge Education_Debit AUD $ 2080,TS-Anz Bank_Trust Brady Hotel Flinders_Debit AUD $ 3410,TS-Anz Bank_Trust Brady Hotel Flinders_Debit AUD $ 4530,TS-Anz Bank_Trust Brady Hotel Flinders_Debit AUD $ 3255,TS-Anz Bank_Trust Brady Hotel Flinders_Debit AUD $ 3755,TS-Anz Bank_Trust Brady Hotel Flinders_Debit AUD $ 3255,TS-Anz Bank_Trust Myung Kyun PARK_Credit AUD $ 24265,TS-Anz Bank_Trust Brady Hotel Flinders_Debit AUD $ 4470,TS-Anz Bank_Trust Brady Hotel Flinders_Debit AUD $ 9560,TS-Anz Bank_Trust Acknowledge Education_Debit AUD $ 2280,TS-Anz Bank_Trust Acknowledge Education_Debit AUD $ 2280,TS-Anz Bank_Trust Acknowledge Education_Debit AUD $ 2280,TS-Anz Bank_Trust Acknowledge Education_Debit AUD $ 2080,TS-Anz Bank_Trust Acknowledge Education_Debit AUD $ 2080,TS-Anz Bank_Trust Thanks Tour_Debit AUD $ 5239,TS-Anz Bank_Trust Brady Hotel Flinders_Debit AUD $ 5810,TS-Anz Bank_Trust Brady Hotel Flinders_Debit AUD $ 190,TS-Anz Bank_Trust The Cathedral School_Debit AUD $ 3400,TS-Anz Bank_Trust The Cathedral School_Debit AUD $ 6800,TS-Anz Bank_Trust Brady Hotel Flinders_Debit AUD $ 4485,TS-Anz Bank_Trust Acknowledge Education_Debit AUD $ 1855,TS-Anz Bank_Trust Acknowledge Education_Debit AUD $ 1855,TS-Anz Bank_Trust Brady Hotel Flinders_Debit AUD $ 3885,TS-Anz Bank_Trust Acknowledge Education_Debit AUD $ 1855,TS-Anz Bank_Trust Acknowledge Education_Debit AUD $ 2080,TS-Anz Bank_Trust DET (Department of Education and Training Victoria)_Debit AUD $ 1018.68,TS-Anz Bank_Trust Brady Hotel Hardware_Debit AUD $ 400,TS-Anz Bank_Trust Brady Hotel Flinders_Debit AUD $ 955,TS-Anz Bank_Trust Brady Hotel Hardware_Debit AUD $ 1995,TS-Anz Bank_Trust Jung Won SA_Credit AUD $ 12700",
TS-Anz Bank_Daily,Time Study,,TS,Anz Bank_Daily,,,,,,,,,,,"TS-Anz Bank_Daily DET (Department of Education and Training Victoria)_Debit AUD $ 302,TS-Anz Bank_Daily DET (Department of Education and Training Victoria)_Debit AUD $ 302,TS-Anz Bank_Daily DET (Department of Education and Training Victoria)_Debit AUD $ 302,TS-Anz Bank_Daily DET (Department of Education and Training Victoria)_Debit AUD $ 302,TS-Anz Bank_Daily DET (Department of Education and Training Victoria)_Debit AUD $ 302,TS-Anz Bank_Daily DET (Department of Education and Training Victoria)_Debit AUD $ 302,TS-Anz Bank_Daily DET (Department of Education and Training Victoria)_Debit AUD $ 302",
TS-Wooribank,Time Study,Sunjae Kim,TS,Wooribank,,,,,,,,CREDIT-2025/06/16_recH7MOp101SaQ8UY,,Unnamed record,"TS-Wooribank Eunsil LEE_Credit KOR ₩ 1000000,TS-Wooribank Eunjung HONG_Credit KOR ₩ 1000000,TS-Wooribank Wheesung ROH_Credit KOR ₩ 1000000,TS-Wooribank Heena YANG_Credit KOR ₩ 1000000,TS-Wooribank Hyekyung BAEK_Credit KOR ₩ 1000000,TS-Wooribank Min Su KANG_Credit KOR ₩ 1000000,TS-Wooribank Jiyeon LEE_Credit KOR ₩ 1000000,TS-Wooribank Sung Bae LEE_Credit KOR ₩ 1000000,TS-Wooribank Bongmin CHOI_Credit KOR ₩ 1000000,TS-Wooribank Soojin JUNG_Credit KOR ₩ 1000000,TS-Wooribank Hayoung JUNG_Credit KOR ₩ 1000000,TS-Wooribank Yesel KIM_Credit KOR ₩ 1000000,TS-Wooribank Euisun AHN_Credit KOR ₩ 1000000,TS-Wooribank Youjin AHN_Credit KOR ₩ 1000000,TS-Wooribank Hyojin HEO_Credit KOR ₩ 1000000,TS-Wooribank Hyojin HEO_Credit KOR ₩ 1000000,TS-Wooribank Hyojin HEO_Credit KOR ₩ 5722600,TS-Wooribank Soojin JUNG_Credit KOR ₩ 7750000,TS-Wooribank Jiyoung KIM_Credit KOR ₩ 1000000,TS-Wooribank Mili KIM_Credit KOR ₩ 1000000,TS-Wooribank Hyoju LIM_Credit KOR ₩ 1000000,TS-Wooribank Oieon PAEK_Credit AUD $ 13420,TS-Wooribank Oieon PAEK_Credit KOR ₩ 1123422,TS-Wooribank Min A LEE_Credit KOR ₩ 1500000,TS-Wooribank Jisoo RYU_Debit KOR ₩ 600000,TS-Wooribank Eunjung HONG_Credit KOR ₩ 55000,TS-Wooribank Uiji JO_Credit KOR ₩ 1000000,TS-Wooribank Hyewon JEONG_Credit KOR ₩ 1000000,TS-Wooribank Ahyoung YOON_Credit KOR ₩ 2000000,TS-Wooribank Hyeonhye HEO_Credit AUD $ 1000000,TS-Wooribank Youngmi Kim_Credit KOR ₩ 1000000",
TS-Kookmin Bank,Time Study,Jungsun KIM,TS,Kookmin Bank,,027701-04-093859,,,,,,,,,TS-Kookmin Bank COEI (CHONGRO Overseas Educational Institute)_Credit KOR ₩ 7746000,
RE-CBA_Seongsoo,RED Uhak,Seongsoo Park,RE,CBA_Seongsoo,064-430,1157-3341,,,,,,,,,"RE-CBA_Seongsoo Hanna JUNG_Credit AUD $ 11700,RE-CBA_Seongsoo Ri YOO_Credit AUD $ 10800,RE-CBA_Seongsoo Yeonkyung JI_Credit AUD $ 13600,RE-CBA_Seongsoo Jihyun LEE_Credit AUD $ 13840,RE-CBA_Seongsoo Seungmi LEE_Credit AUD $ 13200,RE-CBA_Seongsoo Miyoung LIM_Credit AUD $ 15720,RE-CBA_Seongsoo Mira SAGONG_Credit AUD $ 13620,RE-CBA_Seongsoo Taewon GU_Credit KOR ₩ 1000000,RE-CBA_Seongsoo Taewon GU_Credit AUD $ 9800",
SJ-Anz Bank,Time Study,Sunjae KIM,SJ,Anz Bank,013128,487893444,,,,,,,,,SJ-Anz Bank Townsville_Jaehoon JUNG_Debit AUD $ 2000,
Jaehoon JUNG-Commonwealth Bank,Townsville_Jaehoon JUNG,Jaehoon JUNG,Jaehoon JUNG,Commonwealth Bank,064430,11521373,,,,,,,,,,